"symbol","title","url","date","content","author","publish_time"
"CAP","CAP: Ông Lương Quốc Quyền là người ủy quyền thực hiện công bố thông tin","https://vietstock.vn/2024/06/cap-ong-luong-quoc-quyen-la-nguoi-uy-quyen-thuc-hien-cong-bo-thong-tin-214-1200689.htm","21/06/2024","CAP: Ông Lương Quốc Quyền là người ủy quyền thực hiện công bố thông tin","",""
"CAP","CAP: Điều lệ sửa đổi bổ sung lần thứ 15","https://vietstock.vn/2024/06/cap-dieu-le-sua-doi-bo-sung-lan-thu-15-737-1197245.htm","10/06/2024","CAP: Điều lệ sửa đổi bổ sung lần thứ 15
.","",""
"CAP","CAP: Thay đổi giấy đăng ký kinh doanh","https://vietstock.vn/2024/06/cap-thay-doi-giay-dang-ky-kinh-doanh-737-1197237.htm","10/06/2024","CAP: Thay đổi giấy đăng ký kinh doanh","",""
"CAP","Kết quả kinh doanh nửa đầu năm đi lùi, doanh nghiệp vàng mã duy nhất trên sàn lùi ngày chia cổ tức","https://vietstock.vn/2024/05/ket-qua-kinh-doanh-nua-dau-nam-di-lui-doanh-nghiep-vang-ma-duy-nhat-tren-san-lui-ngay-chia-co-tuc-738-1194711.htm","31/05/2024","Kết quả kinh doanh nửa đầu năm đi lùi, doanh nghiệp vàng mã duy nhất trên sàn lùi ngày chia cổ tức
Trước thềm đợt chia cổ tức niên độ 2022-2023 vào ngày 30/05/2024, CTCP Lâm Nông sản Thực phẩm Yên Bái (HNX:CAP) bất ngờ thông báo dời thời gian thanh toán cổ tức bằng tiền thêm 2 tháng.
Theo đó, ngày thanh toán cổ tức bằng tiền niên độ 2022-2023 củaCAPđược dời sang 31/07/2024. Công ty cho biết nguyên nhân là vì chưa chuẩn bị đủ nguồn tiền để thanh toán cổ tức theo kế hoạch. Vì vậy, Công ty cần thời gian cân đối dòng tiền để không làm ảnh hưởng đến hoạt động sản xuất kinh doanh.
Liên quan đến dòng tiền thì theo BCTC 6 tháng đầu niên độ 2023-2024 (01/10/2023-31/03/2024), vì điều chỉnh hàng tồn kho, dòng tiền hoạt động kinh doanh củaCAPâm gần 240 tỷ đồng. Dù vậy, điểm tích cực là hoạt động đầu tư và hoạt động tài chính ghi nhận lần lượt hơn 117 tỷ đồng từ tiền thu hồi cho vay và gần 62 tỷ đồng từ đi vay nên tổng lưu chuyển tiền thuần cả kỳ chỉ còn âm hơn 67 tỷ đồng.
Tuy nhiên, do đầu niên độ, lượng tiền và tương đương tiền củaCAPcòn gần 81 tỷ đồng, với dòng tiền âm như trên, Công ty còn 13.5 tỷ đồng tiền mặt vào thời điểm 31/03/2024, giảm gần 88% so với cuối tháng 3 năm trước.
CAPcũng lưu ý ngoại trừ thời gian thanh toán, các nội dung khác tại thông báo ngày 06/03/2024 của Tổng công ty lưu ký và bù trừ chứng khoán Việt Nam (VSDC) vẫn được giữ nguyên. Cụ thể, ngày đăng ký cuối cùng vẫn là 19/03/2024, tỷ lệ chia cổ tức vẫn giữ nguyên 50% (5,000 đồng/cp).
Trên thực tế, tổng tỷ lệ cổ tức niên độ 2022-2023 củaCAPlên đến 100%. Trong đó, 50% được trả bằng tiền mặt (sở hữu 1 cp được nhận 5,000 đồng) và 50% được trả bằng cổ phiếu (sở hữu 100 cp được nhận thêm 50 cp mới). Với hơn 10.05 triệu cp đang lưu hành,CAPcần chi hơn 50 tỷ đồng và phát hành hơn 5 triệu cp để trả cổ tức lần này.
Đáng chú ý, phần lớn cổ tức sẽ chảy về túi gia đình Chủ tịch HĐQTCAPTrương Ngọc Biênkhi nhóm cổ đông này sở hữu 28.32% vốn. Trong đó, bàHoàng Thị Bình, vợ ông Biên đồng thời là Thành viên HĐQTCAP, nắm nhiều nhất với 11.82%.
Từ khi niêm yết trênHNXnăm 2008,CAPluôn duy trì việc trả cổ tức “đậm” đều đặn hàng năm. Lần gần nhất, Công ty trả cổ tức niên độ 2021-2022 tổng tỷ lệ 70% cho cổ đông (42% bằng tiền và 28% bằng cổ phiếu).
CAPlà doanh nghiệp sản xuất vàng mã hiếm hoi trên sàn, nhưng nguồn thu chủ yếu đến từ kinh doanh tinh bột sắn - mặt hàng nông sản xuất khẩu “tỷ đô” của Việt Nam.
Dù vậy, kết quả kinh doanh nửa đầu niên độ 2023-2024 (từ 01/10/2023-31/03/2024) của Công ty lại có bước đi lùi đáng kể khi doanh thu thuần giảm gần 16% so với cùng kỳ, còn gần 289 tỷ đồng, do khó khăn trong công tác tiêu thụ sản phẩm tinh bột sắn. Cộng với đó, chi phí đầu vào của tinh bộ sắn tăng đáng kể trong khi giá bán tăng nhẹ khiếnCAPchỉ lãi sau thuế hơn 22 tỷ đồng sau 6 tháng, chưa bằng 40% cùng kỳ.
Niên độ 2023-2024, ĐHĐCĐCAPđặt mục tiêu lãi sau thuế tối thiểu 70 tỷ đồng. Với mức lãi hơn 22 tỷ đồng sau 6 tháng, Công ty mới thực hiện được hơn 31% mục tiêu đề ra.
Một điểm đáng chú ý khác là sau ngày chốt danh sách cổ đông nhận cổ tức niên độ 2022-2023, giá cổ phiếuCAPliên tiếp giảm hơn 17% sau hơn 2 tháng, còn 57,000 đồng/cp vào cuối phiên 31/05.","Hà Lễ",""
"CAP","CAP: Thay đổi ngày thanh toán cổ tức","https://vietstock.vn/2024/05/cap-thay-doi-ngay-thanh-toan-co-tuc-738-1194662.htm","31/05/2024","CAP: Thay đổi ngày thanh toán cổ tức
.","",""
"CAP","CAP: Bổ nhiệm Ông Lương Quốc Quyền giữ chức vụ Người phụ trách quản trị, Người ủy quyền CBTT kiêm Thư ký Công ty thay cho Ông Nguyễn Thanh Sơn","https://vietstock.vn/2024/05/cap-bo-nhiem-ong-luong-quoc-quyen-giu-chuc-vu-nguoi-phu-trach-quan-tri-nguoi-uy-quyen-cbtt-kiem-thu-ky-cong-ty-thay-cho-ong-nguyen-thanh-son-214-1193433.htm","27/05/2024","CAP: Bổ nhiệm Ông Lương Quốc Quyền giữ chức vụ Người phụ trách quản trị, Người ủy quyền CBTT kiêm Thư ký Công ty thay cho Ông Nguyễn Thanh Sơn","",""
"CAP","CAP: Nghị Quyết của Hội đồng quản trị về việc gia hạn thời gian thanh toán cổ tức niên độ 2022-2023","https://vietstock.vn/2024/05/cap-nghi-quyet-cua-hoi-dong-quan-tri-ve-viec-gia-han-thoi-gian-thanh-toan-co-tuc-nien-do-20222023-738-1193426.htm","27/05/2024","CAP: Nghị Quyết của Hội đồng quản trị về việc gia hạn thời gian thanh toán cổ tức niên độ 2022-2023
.","",""
"CAP","CAP: Báo cáo Danh sách giao dịch cổ phiếu của Người nội bộ và Người có liên quan đến người nội bộ","https://vietstock.vn/2024/05/cap-bao-cao-danh-sach-giao-dich-co-phieu-cua-nguoi-noi-bo-va-nguoi-co-lien-quan-den-nguoi-noi-bo-739-1192638.htm","23/05/2024","CAP: Báo cáo Danh sách giao dịch cổ phiếu của Người nội bộ và Người có liên quan đến người nội bộ
.","",""
"CAP","CAP: Thông báo thay đổi số lượng cổ phiếu có quyền biểu quyết","https://vietstock.vn/2024/05/cap-thong-bao-thay-doi-so-luong-co-phieu-co-quyen-bieu-quyet-830-1192596.htm","23/05/2024","CAP: Thông báo thay đổi số lượng cổ phiếu có quyền biểu quyết
.","",""
"CAP","CAP: Báo cáo tài chính bán niên năm 2024","https://vietstock.vn/2024/05/cap-bao-cao-tai-chinh-ban-nien-nam-2024-737-1190338.htm","15/05/2024","CAP: Báo cáo tài chính bán niên năm 2024","",""
"CAP","CAP: Ngày 22/05/2024, Thông báo ngày giao dịch đầu tiên niêm yết bổ sung","https://vietstock.vn/2024/05/cap-ngay-22-05-2024-thong-bao-ngay-giao-dich-dau-tien-niem-yet-bo-sung-741-1190168.htm","15/05/2024","CAP: Ngày 22/05/2024, Thông báo ngày giao dịch đầu tiên niêm yết bổ sung","",""
