"symbol","title","url","date","content","author","publish_time"
"HLD","HLD: Ngày đăng ký cuối cùng lấy ý kiến cổ đông bằng văn bản","https://vietstock.vn/2024/09/hld-ngay-dang-ky-cuoi-cung-lay-y-kien-co-dong-bang-van-ban-737-1227724.htm","10/09/2024","HLD: Ngày đăng ký cuối cùng lấy ý kiến cổ đông bằng văn bản
Thông báo ngày đăng ký cuối cùng lập danh sách cổ đông đối với cổ phiếuHLDcủa CTCP Đầu tư và phát triển Bất động sản HUDLAND như sau:1. Ngày đăng ký cuối cùng: 20/09/20242. Ngày giao dịch không hưởng quyền: 19/09/20243. Lý do và mục đích:* Lấy ý kiến cổ đông bằng văn bản:- Tỷ lệ phân bổ quyền: 1 cổ phiếu – 1 quyền biểu quyết- Nội dung xin ý kiến:  Các vấn đề thuộc thẩm quyền của Đại hội đồng cổ đông.- Thời gian thực hiện: Dự kiến thực hiện từ tháng 9/2024 đến tháng 10/2024- Địa điểm thực hiện: + Địa điểm nhận ý kiến cổ đông bản cứng: Công ty cổ phần Đầu tư và Phát triển Bất động sản HUDLAND, tòa nhà HUDLAND Tower, Lô ACC7, Khu dịch vụ tổng hợp Linh Đàm (số 06 Nguyễn Hữu Thọ), phường Hoàng Liệt, quận Hoàng Mai, Thành phố Hà Nội.+ Nhận ý kiến cổ đông file bản mềm qua email: chungkhoanhudland.com.vn","",""
"HLD","HLD: TB Về ngày đăng ký cuối cùng để xin ý kiến cổ đông bằng văn bản","https://vietstock.vn/2024/09/hld-tb-ve-ngay-dang-ky-cuoi-cung-de-xin-y-kien-co-dong-bang-van-ban-737-1225984.htm","04/09/2024","HLD: TB Về ngày đăng ký cuối cùng để xin ý kiến cổ đông bằng văn bản
.","",""
"HLD","HLD: Thông báo về ngày đăng ký cuối cùng để xin ý kiến cổ đông bằng văn bản","https://vietstock.vn/2024/09/hld-thong-bao-ve-ngay-dang-ky-cuoi-cung-de-xin-y-kien-co-dong-bang-van-ban-737-1226266.htm","04/09/2024","HLD: Thông báo về ngày đăng ký cuối cùng để xin ý kiến cổ đông bằng văn bản
.","",""
"HLD","HLD: Báo cáo về ngày trở thành cổ đông lớn - Phạm Thị Linh","https://vietstock.vn/2024/09/hld-bao-cao-ve-ngay-tro-thanh-co-dong-lon-pham-thi-linh-739-1225805.htm","04/09/2024","HLD: Báo cáo về ngày trở thành cổ đông lớn - Phạm Thị Linh
.","",""
"HLD","Tồn kho bất động sản tiếp tục tăng cao","https://vietstock.vn/2024/08/ton-kho-bat-dong-san-tiep-tuc-tang-cao-737-1223208.htm","28/08/2024","Tồn kho bất động sản tiếp tục tăng cao
TheoVietstockFinance, khi xét 115 doanh nghiệp bất động sản trên sàn, giá trị hàng tồn kho tại thời điểm 30/6/2024 ghi nhận hơn 396.8 ngàn tỷ đồng, tăng hơn 12.8 ngàn tỷ đồng (3%) so với đầu năm.
[Chú thích ảnh]: Nguồn:VietstockFinance
Còn xét quy mô tất cả doanh nghiệp trên thị trường, Bộ Xây dựng cho biết, lượng tồn kho bất động sản tại các dự án trên cả nước trong quý 2/2024 khoảng 17,105 căn, nền (bao gồm chung cư, nhà ở riêng lẻ, đất nền), trong đó: chung cư có 2,999 căn; nhà ở riêng lẻ có 7,045 căn; đất nền có 7,061 nền. Theo đó, có thể thấy tỷ trọng tồn kho chủ yếu ở phân khúc nhà ở riêng lẻ và đất nền.
Quý 4/2023, lượng tồn kho vào khoảng 16,315 sản phẩm (bao gồm chung cư, nhà ở riêng lẻ, đất nền), trong đó: chung cư 2,826 căn; nhà ở riêng lẻ 5,173 căn; đất nền 8,316 nền; vẫn chủ yếu là nhà ở riêng lẻ và đất nền.
Như vậy, số liệu của Bộ Xây dựng cho thấy lượng sản phẩm hàng tồn kho trên thị trường cả nước tăng gần 5% sau 6 tháng.
Doanh nghiệp có giá trị tồn kho lớn nhất ngành là CTCP Tập đoàn Đầu tư Địa ốc No Va (HOSE:NVL) với giá trị hơn 142 ngàn tỷ đồng, tăng hơn 2% so với đầu năm và chiếm gần 36% tổng tồn kho các doanh nghiệp trong thống kê (trênHOSE,HNX, UPCoM). Trong đó, giá trị tồn kho bất động sản đã xây dựng hoàn thành gần 8.4 ngàn tỷ đồng, phần lớn là đang xây dựng với gần 134 tỷ đồng.
[Chú thích ảnh]: Nguồn:VietstockFinance
Giá trị hàng tồn khoNVLgấp hơn 2.5 lần so với doanh nghiệp xếp thứ hai làVHM(56.3 ngàn tỷ đồng). Phần lớn là bất động sản đang xây dựng với hơn 48.6 ngàn tỷ đồng (giảm hơn 5%), gồm tiền sử dụng đất, chi phí giải phóng mặt bằng, giá mua các công ty con được phân bổ tại các dự án khu đô thị Vinhomes Ocean Park 2 và 3, Vinhomes Grand Park, Vinhomes Smart City, cùng một số dự án khác.
Ở mảng KCN, Tổng Công ty Đầu tư và Phát triển Công nghiệp (HOSE:BCM) tiếp tục dẫn đầu với giá trị tồn kho hơn 20.6 ngàn tỷ đồng (tăng hơn 4%), đa phần là chi phí đền bù giải phóng mặt bằng, chi phí phải trả để có được quyền sử dụng đất, chi phí đầu tư xây dựng cơ sở hạ tầng và các chi phí khác với gần 18.3 ngàn tỷ đồng.
Theo Công ty Chứng khoánVPBank(VPBankS), tính tới hết năm 2023,BCMsở hữu 350ha đất KCN còn lại tại 6 dự án KCN hiện hữu, hầu hết KCN này đang dần hết diện tích cho thuê với tỷ lệ lấp đầy duy trì trên 90%.VPBankS đánh giáBCMhiện có tiến độ bàn giao đất tương đối chậm hơn so với dự kiến, chủ yếu do những vấn đề liên quan đền bù đất, bất chấp nhu cầu đất KCN vẫn cao tại tỉnh Bình Dương.
Có 15/115 doanh nghiệp có giá trị hàng tồn kho chiếm hơn 50% tổng tài sản, với sự góp mặt 5 ông lớn nhưNVL, CTCP Đầu tư và Kinh doanh Nhà Khang Điền (HOSE:KDH), CTCP Đầu tư Nam Long (HOSE:NLG), CTCP Phát triển Bất động sản Phát Đạt (HOSE:PDR) và CTCP Quốc Cường Gia Lai (HOSE:QCG).
[Chú thích ảnh]: Nguồn:VietstockFinance
KDHlà doanh nghiệp đáng chú ý nhất khi giá trị tồn kho tăng đến 14% sau 6 tháng lên gần 21.5 ngàn tỷ đồng. Theo Công ty, giá trị xây dựng dở dang tại dự án khu nhà ở phường Bình Trưng Đông quy mô 5.8ha (Bình Trưng Đông 1) tăng hơn 1 ngàn tỷ đồng so với đầu năm, lên gần 4.2 ngàn tỷ đồng. Giá trị tại khu dân cư Bình Hưng 11A cũng tăng hơn 900 tỷ đồng, lên hơn 1.5 ngàn tỷ đồng.
Giá trị tồn kho củaNLGtăng 10%, lên gần 19.2 ngàn tỷ đồng, chủ yếu đến từ giá trị dở dang của dự án Izumi (gần 8.7 ngàn tỷ đồng), Waterpoint giai đoạn 1 (hơn 3.8 ngàn tỷ đồng) và giai đoạn 2 (hơn 2 ngàn tỷ đồng), Akari (hơn 2.4 ngàn tỷ đồng).
Vinhomes (HOSE:VHM) vàBCMcó tỷ lệ hàng tồn kho/tổng tài sản lần lượt 11% và 38%.
[Chú thích ảnh]: Nguồn:VietstockFinance
Xét về mức tăng, CTCP Đầu tư và Phát triển Bất động sản HUDLAND (HNX:HLD) dẫn đầu khi lượng tồn kho cuối tháng 6 gấp 5 lần đầu năm, đạt gần 1.9 ngàn tỷ đồng.
Phần chênh lệch chủ yếu từ chi phí sản xuất, kinh doanh dở dang của dự án khu dân cư mới Thôn Phủ, xã Thái Học và thôn Nhuận Đông xã Bình Minh, thuộc huyện Bình Giang, tỉnh Hải Dương (gọi tắt là dự án Bình Giang – Hải Dương) đã tăng từ gần 313 tỷ đồng lên hơn 1,796 tỷ đồng. Hơn 1.4 ngàn tỷ đồng tăng thêm là số tiền sử dụng đất và các nghĩa vụ khác màHLDđã nộp cho Cục thuế tỉnh Hải Dương trong 6 tháng đầu năm 2024.
[Chú thích ảnh]: Nguồn:VietstockFinance
Xếp sauHLDlà CTCP Thống Nhất (HNX:BAX) khi giá trị hàng tồn kho gấp hơn 4 lần đầu năm, với 58 tỷ đồng vào cuối quý 2. Công ty cho biết tại thời điểm 30/6/2024, toàn bộ hàng tồn kho là chi phí thành phẩm bất động sản của: 1 căn cửa hàng thương mại dịch vụ, 11 căn nhà ở thương mại, 36 căn nhà ở xã hội và trường mầm non với tổng diện tích 12,665m2 thuộc dự án phát triển nhà ở khu trung tâm dịch vụ KCN Bàu Xéo.
Ở chiều ngược lại, CTCP Vincom Retail (HOSE:VRE) là doanh nghiệp dẫn đầu nhóm có hàng tồn kho giảm mạnh nhất 64%, về 229 tỷ đồng, chủ yếu là chi phí xây dựng và phát triển các hạng mục nhà phố thương mại để bán.
Ngoài tồn kho, lượng tiền nắm giữ và chi phí xây dựng cơ bản dở dang củaVREcũng giảm lần lượt 78% và 24%, còn hơn 1.1 ngàn tỷ đồng và hơn 782 tỷ đồng. Trong đó, chi phí xây dựng cơ bản giảm chủ yếu do không còn ghi nhận gần 284 tỷ đồng từ Vincom Plaza Điện Biên Phủ sau khi dự án được đưa vào khai thác.
[Chú thích ảnh]: Nguồn:VietstockFinance
Một doanh nghiệp lớn khác cũng ghi nhận giảm tồn kho là CTCP Đầu tư và Phát triển Bất động sản An Gia (HOSE:AGG) khi giảm 46%, về gần 1.1 ngàn tỷ đồng. Trong đó, giá trị bất động sản dở dang của dự án Westgate (Bình Chánh) giảm từ gần 1.4 ngàn tỷ đồng xuống còn 517 tỷ đồng.
Westgate có quy mô 3.1ha với hơn 2,000 căn hộ, shophouse đã bàn giao cho khách hàng từ năm 2023. Trên website dự án vào đầu tháng 6/2024, Westgate cho biết, đã đóng góp 90% vào kế hoạch doanh thu củaAGGtrong năm 2023, tương đương 3,531 tỷ đồng.","Hà Lễ",""
"HLD","HLD: Nguyễn Song Nam - người có liên quan đến Ủy viên HĐQT - đã bán 475,000 CP","https://vietstock.vn/2024/08/hld-nguyen-song-nam-nguoi-co-lien-quan-den-uy-vien-hdqt-da-ban-475000-cp-739-1222730.htm","26/08/2024","HLD: Nguyễn Song Nam - người có liên quan đến Ủy viên HĐQT - đã bán 475,000 CP
- Tên cá nhân thực hiện giao dịch: Nguyễn Song Nam- Mã chứng khoán:HLD- Số lượng cổ phiếu nắm giữ trước khi thực hiện giao dịch: 475,000 CP (tỷ lệ 2.38%)- Tên của người có liên quan tại TCNY:Nguyễn Nam Cường- Chức vụ hiện nay của NCLQ tại tổ chức niêm yết: Phó Giám đốc- Quan hệ của cá nhân thực hiện giao dịch với NCLQ: Anh ruột- Số lượng cổ phiếu NCLQ đang nắm giữ: 0 CP (tỷ lệ 0%)- Tên của người có liên quan tại TCNY:Nguyễn Thanh Hương- Chức vụ hiện nay của NCLQ tại tổ chức niêm yết: Ủy viên HĐQT- Quan hệ của cá nhân thực hiện giao dịch với NCLQ: Em rể- Số lượng cổ phiếu NCLQ đang nắm giữ: 248,000 CP (tỷ lệ 1.24%)- Số lượng cổ phiếu đăng ký bán: 475,000 CP- Số lượng cổ phiếu đã bán: 475,000 CP- Số lượng cổ phiếu nắm giữ sau khi thực hiện giao dịch: 0 CP (tỷ lệ 0%)- Ngày bắt đầu giao dịch: 19/08/2024- Ngày kết thúc giao dịch: 21/08/2024.","",""
"HLD","Doanh nghiệp bất động sản bước chậm trong nửa đầu năm","https://vietstock.vn/2024/08/doanh-nghiep-bat-dong-san-buoc-cham-trong-nua-dau-nam-737-1221795.htm","26/08/2024","Doanh nghiệp bất động sản bước chậm trong nửa đầu năm
Dù thị trường bất động sản trong 6 tháng đầu năm 2024 đã vượt qua giai đoạn khó khăn nhất, nhưng kết quả kinh doanh của nhiều doanh nghiệp bất động sản nhà ở trên sàn vẫn đi lùi, thậm chí có doanh nghiệp còn lỗ cả trăm tỷ đồng.
Theo Bộ Xây dựng, thị trường bất động sản 6 tháng đầu năm 2024 đã có tín hiệu tích cực như mức độ quan tâm, tìm kiếm thông tin về bất động sản của khách hàng, nhà đầu tư tăng cao; lượng giao căn hộ chung cư, nhà ở riêng lẻ và đất nền có xu hướng tăng khi quý sau cao hơn quý trước và cao hơn cùng kỳ 2023. Nguồn cung bất động sản sau một thời gian dài còn hạn chế đang có dấu hiệu chuyển biến tích cực, hàng loạt dự án cũ được tái khởi động cùng với đó là mở bán dự án mới. Lãi suất ngân hàng giảm, các chủ đầu tư đưa ra nhiều chính sách có lợi cho người mua nhà đã tạo niềm tin khách hàng, thanh khoản trên thị trường.
Tuy vậy, cơ quan này cũng lưu ý dù thị trường bất động sản đã vượt qua giai đoạn khó khăn nhất, tuy nhiên, thị trường và các doanh nghiệp bất động sản vẫn đang phải tiếp tục đối diện với nhiều thách thức do ảnh hưởng của nhiều yếu tố bất lợi trong và ngoài nước.
Theo thống kê từVietstockFinance, doanh thu thuần và lợi nhuận ròng của 78 doanh nghiệp bất động sản nhà ở trên sàn trong 6 tháng đầu năm 2024 lần lượt giảm 27% và 36% so với cùng kỳ, còn gần 64.3 ngàn tỷ đồng và hơn 15.5 ngàn tỷ đồng. Trong đó, có 57 doanh nghiệp có lãi, còn lại đều lỗ.
Trong số doanh nghiệp lãi, CTCP Vinhomes (HOSE:VHM) tiếp tục đứng đầu với lãi ròng gần 11.7 ngàn tỷ đồng, song giảm 46% so với nửa đầu năm 2023. Lợi nhuận trong kỳ củaVHMđược đóng góp chính từ việc ghi nhận giao dịch bán lô lớn tại dự án Vinhomes Royal Island và tiếp tục bàn giao các dự án hiện hữu.
[Chú thích ảnh]: Nguồn:VietstockFinance
Không chỉ có đứng thứ ba toàn ngành, lợi nhuận ròng của Tập đoàn Sunshine (HNX:KSF) trong 6 tháng đầu năm 2024 còn gấp gần 11 lần cùng kỳ, với 526 tỷ đồng. Động lực tăng trưởng chủ yếu đến từ doanh thu thuần đạt 2 ngàn tỷ đồng, gấp hơn 17 lần cùng kỳ.
Novaland (HOSE:NVL) lãi ròng 374 tỷ đồng nửa đầu năm, dù không quá ấn tượng nhưng cải thiện so với khoản lỗ hơn 1 ngàn tỷ đồng cùng kỳ. Một trong những sự kiện đáng chú ý nhất củaNVLthời gian qua là khoản lỗ hơn 797 tỷ đồng từ thương vụ thoái vốn hết 99.98% vốn công ty con là CTCP Huỳnh Gia Huy - chủ đầu tư dự án NovaHills Mui Ne, giá chuyển nhượng xấp xỉ 2 tỷ đồng. Sau giao dịch, ôngLê Đình Tuấnđã trở thành Chủ tịch HĐQT kiêm đại diện pháp luật của Huỳnh Gia Huy. Ông Tuấn hiện là Thành viên HĐQT kiêm Phó Tổng Giám đốc CTCP Tập đoàn EverLand (HOSE:EVG).
CTCP Phát triển Đô thị Từ Liêm (HOSE:NTL) bất ngờ lãi gấp hơn 145 lần cùng kỳ, đạt 401 tỷ đồng, qua đó góp mặt đầu tiên trong top 10 doanh nghiệp có mức tăng trưởng lợi nhuận cao nhất ngành. Kết quả này có được là nhờ doanh thu thuần và tài chính đều tăng đột biến sau khi Công ty phản ánh doanh thu bán sản phẩm đã thu đủ tiền của dự án 23ha Bãi Muối, tỉnh Quảng Ninh. Doanh thu gấp 7.3 lần đạt hơn 878 tỷ đồng, còn doanh thu tài chính gấp 456 lần đạt gần 12 tỷ đồng.
Trong nửa đầu năm, 57 doanh nghiệp có lợi nhuận chỉ có 21 doanh nghiệp tăng trưởng so cùng kỳ.
SauNTL, doanh nghiệp xếp thứ hai về mức tăng lợi nhuận là Tổng Công ty Đầu tư Phát triển Nhà và Đô thị Nam Hà Nội (HOSE:NHA) với 41 tỷ đồng, gấp gần 51 lần cùng kỳ.NHAcho biết, sở dĩ có mức tăng này là hoạt động kinh doanh bất động sản chiếm tỷ trọng lớn trong cơ cấu doanh thu kỳ này (hơn 79 tỷ đồng, chiếm 83% tổng doanh thu), trong khi kỳ trước chỉ đến từ hoạt động xây lắp và dịch vụ, đồng thời biên lãi gộp kinh doanh bất động sản cũng cao hơn nhiều lần so với hoạt động khác.
[Chú thích ảnh]: Nguồn:VietstockFinance
Nhiều ông lớn trong ngành xuất hiện trong danh sách 36 doanh nghiệp lãi giảm, có thể kể đến như Tổng CTCP Địa ốc Sài Gòn (HOSE:SGR), Tổng CTCP Đầu tư Phát triển Xây dựng (HOSE:DIG), CTCP Phát triển Bất động sản Phát Đạt (HOSE:PDR), CTCP Đầu tư Nam Long (HOSE:NLG),…
[Chú thích ảnh]: Nguồn:VietstockFinance
Ghi nhận mức giảm nhiều nhất làSGRvới 93%, lợi nhuận chỉ còn hơn 2 tỷ đồng.  Quý 1SGRlỗ gần 14 tỷ đồng, sang quý 2 lợi nhuận giảm 62%. Đáng chú ý doanh thuSGRgấp gần 2.7 lần cùng kỳ đạt gần 78 tỷ đồng. Tuy nhiên, quý 2 năm trướcSGRcó khoản lãi cho vay và chậm thanh toán trong nửa đầu năm hơn 38 tỷ đồng, trong khi năm nay chưa đến 600 triệu đồng. Theo đó, phần doanh thu thuần tăng thêm không đủ bù cho khoản sụt doanh thu tài chính.
Câu chuyện tương tự cũng xảy ra vớiDIGkhi lợi nhuận 6 tháng đầu năm đi lùi 90%, chỉ còn hơn 9 tỷ đồng, chủ yếu là do khoản lỗ 117 tỷ đồng từ quý 1. Trong khi đó, quý 2 tăng đột biến nhờ chuyển nhượng căn hộ tại dự án Cap Saint Jacques (CSJ), chuyển nhượng nhà xây thô tại dự án Đại Phước và dự án Vị Thanh, qua đó lãi ròng quý 2 gấp đến 12 lần cùng kỳ với hơn 126 tỷ đồng, dù vậy vẫn không đủ để có kết quả nửa đầu năm tăng trưởng.
Cuối cùng là 21 doanh nghiệp lỗ, đáng chú ý nhất trong đó là CTCP Đầu tưLDG(HOSE:LDG) không chỉ có mức lỗ cao nhất ngành trong 6 tháng đầu năm mà còn là doanh nghiệp duy nhất âm doanh thu thuần. Nguyên nhân là giá trị bất động sản bị trả lại lên đến 316 tỷ đồng, trong khi doanh thu bán hàng xấp xỉ 156 tỷ đồng, dẫn tới doanh thu thuần âm hơn 149 tỷ đồng nửa đầu năm. Cộng với chi phí trong kỳ giảm không đáng kể nênLDGphải chịu lỗ ròng hơn 296 tỷ đồng. Đưa lỗ lũy kế tính tới cuối tháng 6 lên hơn 175 tỷ đồng.
[Chú thích ảnh]: Nguồn:VietstockFinance
CTCP Quốc Cường Gia Lai (HOSE:QCG) cũng đang thu hút sự chú ý trong thời gian qua. Ngoài việc Tổng Giám đốcNguyễn Thị Như Loanbị bắt vào tháng 7 thì Công ty còn trải qua quý 2/2024 với khoản lỗ nặng nhất từ năm 2012 đến nay.
Doanh thu thuần quý 2 giảm 41%, chỉ còn hơn 26 tỷ đồng do thị trường bất động sản nói chung còn nhiều khó khăn.QCGcho biết quý 2 hàng năm vẫn chưa bước vào mùa mưa nên sản lượng điện khai thác còn thấp. Cùng với đó, cao su chỉ được đưa vào khai thác từ cuối tháng 5 dẫn đến doanh thu giảm so với cùng kỳ. Mặt khác, chi phí khấu hao và lãi vay hàng tháng không phụ thuộc vào sản lượng khai thác, dẫn đến giá vốn cao hơn doanh thu. Hệ quả là lỗ ròng hơn 16 tỷ đồng trong quý 2, kéo kết quả 6 tháng âm hơn 15 tỷ đồng.
Với nhiều kết quả lỗ và lãi đi lùi, tỷ lệ thực hiện kế hoạch kinh doanh năm 2024 của đa số doanh nghiệp bất động sản nhà ở trong nửa đầu năm không mấy khả quan. Trong 57 doanh nghiệp có lãi thì chỉ có 10 doanh nghiệp thực hiện trên 50% mục tiêu năm sau 6 tháng.
[Chú thích ảnh]: Nguồn:VietstockFinance
Ba doanh nghiệp gồm CTCP Đầu tư Phát triển Sài Gòn Co.op (UPCoM:SID),NTLvà CTCP Địa ốc Sài Gòn Thương Tín (HOSE:SCR) đều vượt kế hoạch lợi nhuận năm. Trong đó,NTLvượt 57% kế hoạch nhờ tăng trưởng lợi nhuận đột biến. CònSIDvàSCRđặt mục tiêu lợi nhuận khiêm tốn khi thấp hơn mức thực hiện của năm 2023.
Đối vớiPDR, tại ĐHĐCĐ thường niên 2024 hồi tháng 4, ban lãnh đạo đã lường trước mức thực hiện kế hoạch lợi nhuận chỉ đạt 12% trong nửa đầu năm. Chủ tịch HĐQTNguyễn Văn Đạtcho biết, lợi nhuận của Công ty chủ yếu ghi nhận vào nửa cuối năm khi dự án trọng điểm là Bắc Hà Thanh dự kiến từ tháng 5-6 hoàn thành đóng tiền sử dụng đất và đủ điều kiện bán hàng. Theo kế hoạch, dự án sẽ bắt đầu bán hàng từ quý 2 và ghi nhận doanh thu, lợi nhuận vào hai quý cuối năm.","Hà Lễ",""
"HLD","HLD: Nguyễn Song Nam - người có liên quan đến Ủy viên HĐQT - đăng ký bán 475,000 CP","https://vietstock.vn/2024/08/hld-nguyen-song-nam-nguoi-co-lien-quan-den-uy-vien-hdqt-dang-ky-ban-475000-cp-739-1219610.htm","15/08/2024","HLD: Nguyễn Song Nam - người có liên quan đến Ủy viên HĐQT - đăng ký bán 475,000 CP
- Tên cá nhân thực hiện giao dịch: Nguyễn Song Nam- Mã chứng khoán:HLD- Số lượng cổ phiếu nắm giữ trước khi thực hiện giao dịch: 475,000 CP (tỷ lệ 2.38%)- Tên của người có liên quan tại TCNY:Nguyễn Nam Cường- Chức vụ hiện nay của NCLQ tại tổ chức niêm yết: Phó Giám đốc- Quan hệ của cá nhân thực hiện giao dịch với NCLQ: Anh ruột- Số lượng cổ phiếu NCLQ đang nắm giữ: 0 CP (tỷ lệ 0%)- Tên của người có liên quan tại TCNY:Nguyễn Thanh Hương- Chức vụ hiện nay của NCLQ tại tổ chức niêm yết: Ủy viên HĐQT- Quan hệ của cá nhân thực hiện giao dịch với NCLQ: Em rể- Số lượng cổ phiếu NCLQ đang nắm giữ: 248,000 CP (tỷ lệ 1.24%)- Số lượng cổ phiếu đăng ký bán: 475,000 CP- Mục đích thực hiện giao dịch: Đáp ứng nhu cầu tài chính cá nhân- Phương thức giao dịch: Thỏa thuận và khớp lệnh- Ngày dự kiến bắt đầu giao dịch: 16/08/2024- Ngày dự kiến kết thúc giao dịch: 13/09/2024.","",""
"HLD","HLD: Công bố thông tin ký hợp đồng kiểm toán báo cáo tài chính năm 2024","https://vietstock.vn/2024/08/hld-cong-bo-thong-tin-ky-hop-dong-kiem-toan-bao-cao-tai-chinh-nam-2024-737-1217566.htm","08/08/2024","HLD: Công bố thông tin ký hợp đồng kiểm toán báo cáo tài chính năm 2024
.","",""
"HLD","HLD: Báo cáo tài chính bán niên năm 2024","https://vietstock.vn/2024/08/hld-bao-cao-tai-chinh-ban-nien-nam-2024-737-1217573.htm","08/08/2024","HLD: Báo cáo tài chính bán niên năm 2024","",""
"HLD","HLD: Nghị quyết Đại hội đồng cổ đông thường niên năm 2024","https://vietstock.vn/2024/07/hld-nghi-quyet-dai-hoi-dong-co-dong-thuong-nien-nam-2024-737-1212804.htm","29/07/2024","HLD: Nghị quyết Đại hội đồng cổ đông thường niên năm 2024","",""
"HLD","HLD: Tài liệu họp Đại hội đồng cổ đông","https://vietstock.vn/2024/07/hld-tai-lieu-hop-dai-hoi-dong-co-dong-737-1212146.htm","26/07/2024","HLD: Tài liệu họp Đại hội đồng cổ đông","",""
"HLD","HLD: Báo cáo quản trị công ty bán niên 2024","https://vietstock.vn/2024/07/hld-bao-cao-quan-tri-cong-ty-ban-nien-2024-737-1212050.htm","26/07/2024","HLD: Báo cáo quản trị công ty bán niên 2024","",""
"HLD","HLD: Báo cáo thay đổi sở hữu cổ phiếu của cổ đông lớn - Phạm Thị Linh","https://vietstock.vn/2024/07/hld-bao-cao-thay-doi-so-huu-co-phieu-cua-co-dong-lon-pham-thi-linh-739-1211611.htm","25/07/2024","HLD: Báo cáo thay đổi sở hữu cổ phiếu của cổ đông lớn - Phạm Thị Linh
.","",""
"HLD","HLD: Báo cáo tài chính quý 2/2024","https://vietstock.vn/2024/07/hld-bao-cao-tai-chinh-quy-2-2024-737-1210116.htm","22/07/2024","HLD: Báo cáo tài chính quý 2/2024","",""
