"symbol","title","url","date","content","author","publish_time"
"EVS","Tự doanh công ty chứng khoán đang nắm gì trong danh mục?","https://vietstock.vn/2024/11/tu-doanh-cong-ty-chung-khoan-dang-nam-gi-trong-danh-muc-737-1244647.htm","13/11/2024","Tự doanh công ty chứng khoán đang nắm gì trong danh mục?
Dù không tăng nhiều, mảng tự doanh vẫn mang về cho nhóm công ty chứng khoán (CTCK) khoản lợi nhuận hơn 3.53 ngàn tỷ đồng. Đâu là những con át chủ bài trong danh mục của các CTCK?
Theo dữ liệu từVietstockFinance, quý 3/2024, hoạt động tự doanh của công ty chứng khoán thu lãi hơn 3.53 ngàn tỷ đồng. Kết quả tự doanh giảm nhẹ 0.6% so với quý trước. Tuy vậy, so với cùng kỳ, kết quả này cải thiện hơn 11%.
[Chú thích ảnh]: Nguồn:VietstockFinance
Lợi nhuận tự doanh phản ánh diễn biến của thị trường chứng khoán trong quý 3 với một nhịp giảm mạnh từ 1,285 về 1,190 điểm và sau đó bật lại về vùng 1,285 điểm củaVN-Index. Thị trường chưa thoát khỏi vùng kháng cự đã khiến CTCK khó tăng trưởng lợi nhuận tự doanh.
So với cùng kỳ, lãi tài sản tài chính ghi nhận qua lãi/lỗ (FVTPL) giảm 10%, ở mức 7.58 ngàn tỷ đồng; lỗ tài sản FVTPL giảm 18%, về 3.8 ngàn tỷ đồng. Nhờ kiểm soát được phần lỗ tài sản FVTPL, tự doanh ghi nhận con số lãi tăng so với cùng kỳ.
Trong quý này, quy mô lợi nhuận tự doanh giữa các CTCK có sự cách biệt lớn. Chứng khoánSSIdẫn đầu về lãi tự doanh, đạt trên 702 tỷ đồng; bỏ xa vị trí thứ hai là Chứng khoán Kỹ Thương (TCBS) với mức lãi đạt 465.8 tỷ đồng.
Tự doanh củaSSIlãi tăng 15% so với quý trước và 19% so với cùng kỳ. Trong khi đó, lãi tự doanh củaTCBSgiảm khoảng 30% so với cả quý trước và cùng kỳ.
Nhóm CTCK chứng kiến một số trường hợp tăng mạnh lãi tự doanh là Chứng khoánVIX, lãi gần 220 tỷ đồng, gấp 4 lần quý trước và gần gấp đôi cùng kỳ.
Quy mô lãi củaACBScũng bật tăng lên trên 165 tỷ đồng, gấp hơn 2 lần cùng kỳ và chuyển lỗ quý 2 thành lãi trong quý này.
Dù vậy, một số công ty phải báo lỗ đậm ở mảng này. Chứng khoánAPGlỗ tới 160 tỷ đồng. Chứng khoán HD lỗ tới gần 60 tỷ đồng.SHSlỗ hơn 50 tỷ đồng.
VớiAPG, mảng tự doanh là nguyên nhân chính khiến Công ty chịu lỗ quý 3 gần 150 tỷ đồng. Về phần Chứng khoán HD, kết quả lỗ lại có phần tích cực khi quy mô lỗ đã giảm so với các quý trước, từ 200-300 tỷ đồng về chỉ còn 60 tỷ đồng.
Dẫn đầu lợi nhuận tự doanh, Chứng khoánSSIđang nắm giữ gần 1.9 ngàn tỷ đồng cổ phiếu niêm yết. Danh mục này tạm lãi 3.5%. Trong đó,VPBvàHPGlà 2 khoản đầu tư nổi bật.
Xét danh mục tài sản FVTPL,SSIđang nắm tới 13 ngàn tỷ đồng trái phiếu chưa niêm yết và gần 21 ngàn tỷ đồng chứng chỉ tiền gửi.
VớiTCBS, các khoản đầu tư trái phiếu chưa niêm yết vẫn đóng vai trò quan trọng. Tài sản tài chính của Công ty chủ yếu nằm ở tài sản sẵn sàng để bán (AFS), 83% là trái phiếu chưa niêm yết, giá trị hơn 11.1 ngàn tỷ đồng.
VNDIRECT cũng nắm hơn 11 ngàn tỷ đồng trái phiếu chưa niêm yết và gần 8 ngàn tỷ đồng chứng chỉ tiền gửi.
Ở danh mục cổ phiếu, Công ty nắm chủ yếu làVPBvà HSG.
Khoản lãi khủng của Vietcap đang nằm ở danh mục tài sản AFS, với các khoản đầu tư vàoKDH,IDP,TDM,FPT. Trong đó, khoản đầu tư vàoIDPđã gấp 5 lần giá trị.
Chứng khoánVPStập trung nắm giữ trái phiếu niêm yết và công cụ thị trường tiền tệ.
Đối vớiVIX, cổ phiếu niêm yết và trái phiếu chưa niêm yết là 2 mũi nhọn chủ lực. Mặt khác, Công ty vẫn đang nắm khoản ủy thác đầu tư 1.9 ngàn tỷ đồng.
Bứt tốc trên đường đua tự doanh, Chứng khoánVPBank(VPBankS) có danh mục khá giống các công ty dẫn đầu, tập trung vào chứng chỉ tiền gửi và trái phiếu.
ACBSthì tập trung vào cổ phiếu với tỷ trọng cổ phiếu chiếm đến 3/4 giá trị tài sản FVTPL.
Chứng khoán TPHCM (HSC) nắm hơn 5.2 ngàn tỷ đồng trái phiếu niêm yết và giao dịch trên sàn riêng lẻ.
Tự doanh của Chứng khoán Kafi đang theo chiến lược chung - phân bổ vào tài sản an toàn là giấy tờ có giá và tiền gửi có kỳ hạn; đồng thời, phân bổ một phần vào cổ phiếu và trái phiếu.
Ở nhóm lỗ tự doanh, danh mục phần lớn là nắm giữ cổ phiếu.
Chứng khoánAPGnắm danh mục tập trung vào cổ phiếu. Tới cuối quý 3, danh mục này tạm lỗ hơn 143 tỷ đồng.
Danh mục củaHDStập trung vào trái phiếu chưa niêm yết với giá trị 931 tỷ đồng, chiếm đến 95% cơ cấu danh mục.
Chứng khoán Asean nắm phần lớn là cổ phiếu niêm yết. Giá mua vào 285.9 tỷ đồng, tạm lãi hơn 60%. Tuy vậy, công ty vẫn phải báo lỗ tự doanh do danh mục cổ phiếu nắm giữ giảm đáng kể so với cuối quý 2. Ở thời điểm cuối quý 2, Công ty nắm cùng danh mục hiện tại với mức lãi tới 76%.
Các cổ phiếu nổi bật trong danh mục của Aseansc gồmHTM,SGP,TSJ. Trong đó,SGPlà khoản lãi có hiệu suất cao nhất.
Chứng khoánEVSnắm 374 tỷ đồng cổ phiếu niêm yết (tạm lỗ 13.5%). Danh mục Chứng khoán khác chiếm tỷ trọng cao nhất với giá trị gần 590 tỷ đồng (tạm lãi 4%).
Chứng khoánSHStập trung vào 2 khoản mục chính là cổ phiếu niêm yết và trái phiếu niêm yết, giá trị lần lượt 3.5 ngàn tỷ đồng và gần 1.7 ngàn tỷ đồng. Ngoài ra, Công ty cũng nắm giữ 475 tỷ đồng cổ phiếu niêm yết trong danh mục tài sản AFS. Các khoản đầu tư này tạm lãi gần 40%.","Chí Kiên",""
"EVS","Tự doanh, môi giới hụt hơi, mảng cho vay gánh lợi nhuận quý 3 của công ty chứng khoán","https://vietstock.vn/2024/10/tu-doanh-moi-gioi-hut-hoi-mang-cho-vay-ganh-loi-nhuan-quy-3-cua-cong-ty-chung-khoan-737-1240462.htm","29/10/2024","Tự doanh, môi giới hụt hơi, mảng cho vay gánh lợi nhuận quý 3 của công ty chứng khoán
Tổng lợi nhuận của nhóm công ty chứng khoán sụt giảm trong quý 3/2024. Mức giảm có thể còn cao hơn nếu mảng cho vay không có một quý khả quan.
Theo dữ liệu củaVietstockFinance, tổng lợi nhuận sau thuế của 80 công ty chứng khoán (CTCK) đạt hơn 5.58 ngàn tỷ đồng lãi sau thuế. Kết quả này đồng thời giảm 15% so với quý liền trước và 2% so với cùng kỳ.
Số CTCK báo lãi giảm so với quý 2 là 35/80 và so với quý 3 năm trước là 34/80. Đồng thời có 19 CTCK báo lỗ.
[Chú thích ảnh]: Nguồn:VietstockFinance
Trong quý 3, hoạt động cho vay trở thành nguồn đóng góp chủ lực vào kết quả kinh doanh của CTCK. Lãi cho vay, phải thu đồng thời tăng so với cùng kỳ và quý trước. Quy mô lãi cho vay, phải thu đạt gần 6.1 ngàn tỷ đồng, gấp gần 2 lần doanh thu môi giới và lãi tự doanh.
Khép lại quý 3/2024, dư nợ cho vay (chủ yếu hoạt động margin) của nhóm CTCK tiếp tục được nâng lên cột mốc mới - gần 236.7 ngàn tỷ đồng, tăng 4% so với quý 2 liền trước và tăng 30% so với đầu năm nay.
Ngược chiều với mảng cho vay, mảng môi giới đang có xu hướng giảm doanh thu trong các quý gần đây; trong khi lợi nhuận từ mảng tự doanh không có nhiều đột phá.
Sự khó khăn của mảng môi giới và tự doanh phần nào thể hiện diễn biến thị trường quý 3. Thanh khoản thị trường đi xuống, khối lượng giao dịch 2 sànHOSEvàHNXbình quân đạt gần 17.8 ngàn tỷ đồng/phiên - thấp hơn mức 24 ngàn tỷ đồng/phiên của quý trước và 21.1 ngàn tỷ đồng/phiên nếu so với cùng kỳ năm 2023.
Về mặt điểm số,VN-Indexnhiều lần nỗ lực vượt mốc 1,300 điểm bất thành và rung lắc quanh vùng 1,250 - 1,280 điểm. Thị trường không có đột phá khiến hoạt động tự doanh khó kiếm lời hơn trước.
Đi vào chi tiết, quý 3 năm nay, Chứng khoán Kỹ Thương (TCBS) dẫn dầu lợi nhuận toàn nhóm. Song đây là mức lợi nhuận sụt giảm, chỉ còn 877 tỷ đồng chứ không được ngàn tỷ đồng như quý trước. Đóng góp chính vào doanh thu hoạt động củaTCBSvẫn là lãi từ cho vay, phải thu với hơn 706 tỷ đồng, tăng 67% so với cùng kỳ.
Xếp thứ hai là Chứng khoánSSIvới mức lãi ròng 750 tỷ đồng – mức tăng so với cùng kỳ song lại giảm so với quý trước. Quý 3, doanh thu môi giới củaSSIgiảm đến 36% nhưng bù lại, lãi từ tài sản FVTPL đạt 990 tỷ đồng, tăng 32%; lãi cho vay và phải thu đạt gần 550 tỷ đồng, tăng 27%.
Về thứ 3 là Chứng khoánVPS(VPSS). Công ty ghi nhận lãi ròng 656 tỷ đồng, đồng thời tăng so với quý trước và cùng kỳ.
Đối với Chứng khoán VNDIRECT (VND), 3 mảng kinh doanh chính là tự doanh, môi giới và cho vay đều gặp khó, khiến lãi ròng quý 3 giảm 21%, về còn 505 tỷ đồng.
Kết quả của các công ty trong top 10 có sự cách biệt lớn về lợi nhuận của nhóm dẫn đầu so với nhóm bám đuôi. Các vị trí xếp sau đều có lợi nhuận, nhưng thấp hơn mốc 300 tỷ đồng - cách xa so với nhóm trên.
[Chú thích ảnh]: Nguồn:VietstockFinance
Quý 3, một số Công ty có kết quả tăng mạnh. Chứng khoán LPBS báo lãi ròng tăng mạnh nhất toàn nhóm - tăng 95% so với quý 2 và gấp 3 lần cùng kỳ, do phát sinh lãi từ hoạt động cho vay, sau khi hoàn tất đăng ký nghiệp vụ giao dịch ký quỹ (margin). LPBS đã hoàn tất đăng ký nghiệp vụ giao dịch ký quỹ, ứng trước và triển khai mở rộng thị phần… qua đó tạo ra nguồn thu mới gần 48 tỷ đồng lãi từ hoạt động cho vay và hơn 13 tỷ đồng doanh thu mảng môi giới chứng khoán trong quý 3/2024.
Chứng khoánVPS, Chứng khoán Tiên Phong (TPS) cũng ghi nhận lợi nhuận tăng trên 100% với quý 3 năm trước.
[Chú thích ảnh]: Nguồn: ViestockFinance
19 CTCK báo lỗ trong quý này - con số tương đương các quý trước. Chứng khoánAPGdẫn đầu nhóm với khoản lỗ gần 150 tỷ đồng, do mảng tự doanh kém khả quan. Chênh lệch giảm đánh giá lại các tài sản tài chính FVTPL tăng đột biến - lên mức 160 tỷ đồng là tác nhân chính dẫn đến kết quả này.
Cuối quý 3, danh mục tài sản tài chính FVTPL củaAPGchủ yếu là cổ phiếu niêm yết có giá trị hợp lý hơn 503 tỷ đồng, thấp hơn 143 tỷ đồng so với giá gốc 646 tỷ đồng, phần nào phản ánh khoản lỗ nặng quý 3.
Chứng khoán Everest (EVS) xếp thứ hai với khoản lỗ ròng gần 28 tỷ đồng. Nguyên nhân chính cũng do tự doanh. Trong quý 3,EVSchỉ ghi nhận lãi từ tài sản tài chính FVTPL 23 tỷ đồng, giảm đến 81%; trong khi lỗ tài sản tài chính FVTPL tăng 54%, lên hơn 40 tỷ đồng. Kết quả này cũng đồng nghĩa với việc Công ty phải chịu lỗ gần 18 tỷ đồng mảng tự doanh, trong khi quý 3/2023 lãi hơn 93 tỷ đồng.
Một số khoản lỗ nổi bật khác thuộc về Chứng khoán Asean (SeASecurities), Chứng khoán Tân Việt (TVSI), Chứng khoán Phú Hưng (PHS), Chứng khoánSBS, Chứng khoánCVSvới mức lỗ trên dưới 10 tỷ đồng.
[Chú thích ảnh]: Nguồn:VietstockFinance","Chí Kiên",""
"EVS","Tự doanh gặp khó, Chứng khoán Everest chịu lỗ trong quý 3","https://vietstock.vn/2024/10/tu-doanh-gap-kho-chung-khoan-everest-chiu-lo-trong-quy-3-737-1238460.htm","21/10/2024","Tự doanh gặp khó, Chứng khoán Everest chịu lỗ trong quý 3
CTCP Chứng khoán Everest (HNX:EVS) trải qua quý 3/2024 không thành công khi chịu lỗ ròng 28 tỷ đồng, trong khi cùng kỳ năm trước lãi ròng 58 tỷ đồng, chịu tác động bởi mảng tự doanh thua lỗ.
Trong kỳ,EVSchỉ ghi nhận lãi từ tài sản tài chính FVTPL 23 tỷ đồng, giảm đến 81%, trong khi lỗ tài sản tài chính ghi nhận thông qua lãi/lỗ (FVTPL) tăng 54% lên hơn 40 tỷ đồng. Kết quả này cũng đồng nghĩa với việc Công ty phải chịu lỗ gần 18 tỷ đồng mảng tự doanh, trong khi quý 3/2023 lãi hơn 93 tỷ đồng.
Sự đi xuống của hoạt động tự doanh là tác nhân chính khiếnEVSlỗ ròng gần 28 tỷ đồng trong quý 3, qua đó kéo tụt lãi lũy kế 9 tháng đầu năm xuống chỉ còn hơn 4 tỷ đồng.
[Chú thích ảnh]: Nguồn:VietstockFinance
Tại thời điểm kết thúc quý 3/2024, tổng tài sản củaEVSghi nhận hơn 2,498 tỷ đồng, tăng 6% so với đầu năm. Cơ cấu tài sản chiếm phần lớn là tài sản tài chính FVTPL và các khoản phải thu.
Cụ thể, quy mô tài sản tài chính FVTPL củaEVShơn 1,053 tỷ đồng, giảm mạnh 35% so với đầu năm, bao gồm gần 324 tỷ đồng đầu tư vào cổ phiếu niêm yết, gần 117 tỷ đồng cổ phiếu chưa niêm yết và gần 613 tỷ đồng chứng khoán khác. So với đầu năm, quy mô tài sản tài chính FVTPL chủ yếu giảm mạnh ở các chứng khoán khác.
Danh mục đầu tư không được thuyết minh trên BCTC quý 3/2024 củaEVS. Nếu nhìn vào danh mục cuối quý 2 trước đó, Công ty dành phần lớn nguồn lực để đầu tư vào trái phiếu niêm yết, nổi bật là trái phiếu của CTCP Thương mại Dịch vụ Hoa Lâm An, CTCP Đầu tư Địa ốc Mai Viên; cổ phiếu niêm yết trênHNX, nổi bật là NVB.
Các khoản phải thu mà phần lớn là phải thu bán các tài sản tài chính, quy mô đạt gần 933 tỷ đồng, gấp 4.5 lần đầu năm. Công ty cũng còn hơn 61 tỷ đồng phải thu cổ tức, tiền lãi đến ngày nhận.
Tài sản Công ty được tài trợ phần lớn bởi vốn chủ sở hữu 1,955 tỷ đồng, còn lại là gần 544 tỷ đồng nợ phải trả, chủ yếu là vay ngắn hạn gần 263 tỷ đồng và phải trả hoạt động giao dịch chứng khoán hơn 196 tỷ đồng.","Huy Khải",""
"EVS","EVS: Báo cáo tài chính quý 3/2024","https://vietstock.vn/2024/10/evs-bao-cao-tai-chinh-quy-3-2024-737-1238055.htm","21/10/2024","EVS: Báo cáo tài chính quý 3/2024","",""
"EVS","Bên mua (Buy side) đặt ra tiêu chí thế nào khi tìm hiểu doanh nghiệp?","https://vietstock.vn/2024/09/ben-mua-buy-side-dat-ra-tieu-chi-the-nao-khi-tim-hieu-doanh-nghiep-145-1228825.htm","16/09/2024","Bên mua (Buy side) đặt ra tiêu chí thế nào khi tìm hiểu doanh nghiệp?
Các thông tin về pháp lý, tài chính, thương mại… cần được cung cấp chính xác và đầy đủ là một trong những tiêu chí mà bên mua (Buy side) đặt ra tìm hiểu doanh nghiệp trước khi quyết định xuống tiền.
[Chú thích ảnh]: Bà Nguyễn Thị Linh, Giám đốc khối Dịch vụ Ngân hàng Đầu tư của Chứng khoán Everest
Đó là chia sẻ của bà Nguyễn Thị Linh - Giám đốc Khối Dịch vụ Ngân hàng đầu tư, CTCP Chứng khoán Everest (HOSE:EVS) với chúng tôi về câu chuyện minh bạch thông tin của doanh nghiệp.
Bà Nguyễn Thị Linh:EVSđánh giá Việt Nam vẫn là một trong những mảnh đất đầy tiềm năng cho cho thị trường IB vì một số lý do sau:
- Nâng hạng thị trường chứng khoán giúp thị trường chứng khoán Việt Nam sẽ thu hút được nguồn vốn rất lớn từ các nhà đầu tư nước ngoài. Bên cạnh đó, các giải pháp nâng hạng thị trường đang được triển khai cũng tăng cường tính minh bạch, cung cấp nhiều thông tin hơn cho các nhà đầu tư nước ngoài, để họ có thể ra quyết định đầu tư đúng đắn và hiệu quả hơn.
Các nhà đầu tư nước ngoài có xu hướng thực hiện đầu tư dài hạn vào các sản phẩm đầu tư tốt và chất lượng như cổ phiếu, trái phiếu, chứng chỉ quỹ, các thương vụ M&A. Chính vì vậy, thị trường IB sẽ có tiềm năng phát triển to lớn, cùng với đó, mảng IB của các công ty chứng khoán sẽ hưởng lợi rất nhiều từ việc nâng hạng thị trường chứng khoán.
-EVSxác định mảng IB là một trong các trụ cột trong hoạt động kinh doanh của Công ty. Phát triển các sản phẩm dịch vụ IB không chỉ đem lại hiệu quả trực tiếp cho hoạt động kinh doanh, mà còn đem lại các lợi ích gián tiếp cho hoạt động đầu tư tự doanh, gia tăng thêm thị phần môi giới…
Bên cạnh thế mạnh từ các sản phẩm dịch vụ truyền thống như tư vấn thoái vốn Nhà nước, tư vấn cổ phần hóa, tư vấn chào bán và phát hành cổ phiếu, tư vấn và đại lý phát hành trái phiếu,…EVSđịnh hướng phát triển thêm các sản phẩm giá trị gia tăng nhằm cung cấp giải pháp tài chính quản trị toàn diện cho các doanh nghiệp niêm yết và doanh nghiệp tiềm năng có kế hoạch tham gia thị trường chứng khoán, startup có nhu cầu gọi vốn từ các quỹ trong và ngoài nước.
- Hoạt động IPO, niêm yết có sôi động trở lại không còn phụ thuộc vào một trong các yếu tố như tăng trưởng của kinh tế Việt Nam; sự sôi động của thị trường chứng khoán; các khung khổ pháp lý liên quan đến quy định về IPO, niêm yết, nhu cầu vốn của các công ty.
Mảng tư vấn niêm yết hiện là một trong các hoạt động củaEVS. Đối với các doanh nghiệp đượcEVSđánh giá hoạt động tốt bên cạnh hoạt động cung cấp dịch vụ tư vấn niêm yết, Công ty có thể trở thành nhà đầu tư từ khi doanh nghiệp chưa niêm yết và trở thành nhà đầu tư đi cùng doanh nghiệp trong quá trình IPO, niêm yết trên các Sở giao dịch chứng khoán.
-EVSđánh giá hoạt động IR là rất quan trọng trong quá trình IPO, niêm yết hay chào bán chứng khoán, hoạt động IR hướng tới các Nhà đầu tư, cung cấp thông tin tài chính thông tin quản trị phát triển danh tiếng mối quan hệ của Công ty. Đây là hoạt động quan trọng góp phần trong việc IPO, niêm yết hay chào bán cổ phần của Doanh nghiệp;
Khi tham gia tư vấn cung cấp các dịch vụ tư vấn tài chính hoặc các dịch vụ IB,EVSluôn chú trọng đến tư vấn cải thiện năng lực IR cho doanh nghiệp. Trong đó, các hoạt động tư vấn nâng cao năng lực IR của doanh nghiệp đượcEVStư vấn như hướng dẫn doanh nghiệp thực hiện công bố thông tin định kỳ bất thường theo quy định của pháp luật, theo thông lệ tốt;
Tư vấn quản trị doanh nghiệp, tư vấn áp dụng các cam kết tuyên bố về ESG, tư vấn tổ chức các hội thảo hội nghị tiếp xúc cổ đông nhà đầu tư, cách thức xây dựng các báo cáo về phát triển bền vững, các yếu tố liên quan và đánh giá, đo lường các tác động yếu tố liên quan đến hoạt động kinh doanh của Doanh nghiệp.
- Hiện tại, các công ty niêm yết đang giao tiếp với các nhà đầu tư là tương tác một chiều thông qua thông tin được công bố theo quy định của pháp luật (Công bố thông tin định kỳ gồm Báo cáo tài chính, Báo cáo thường niên, Báo cáo quản trị và công bố thông tin bất thường như Báo cáo về Nghị quyết HĐQT, giao dịch bên liên quan, Nghị quyết ĐHĐCĐ thường niên, bất thường…).
Chỉ một số công ty niêm yết lớn, các công ty tiêu biểu mới có các bản tin IR hoặc có các diễn đàn, hội thảo công bố thông tin doanh nghiệp hàng quý, bán niên, hàng năm.
Các nhà đầu tư tổ chức quan tâm đến các hoạt động kinh doanh, xu hướng kinh doanh thường xuyên của doanh nghiệp, cần có bản tin song ngữ, các dự báo xu hướng và đánh giá đối thủ cạnh tranh.
EVShiện tại đang hỗ trợ các Công ty niêm yết thực hiện tương tác với nhà đầu tư ở nhiều cấp độ trong đó dịch vụ hỗ trợ trọn gói bao gồm từ ĐHĐCĐ với phương thức trực tiếp và trực tuyến, tư vấn hỗ trợ IR với tư vấn công bố thông tin theo quy định, thực hiện các thông lệ quản trị theo thẻ điểm, tư vấn và hỗ trợ tổ chức hội thảo, diễn đàn cơ hội đầu tư và cung cấp các báo cáo định kỳ hàng tháng, báo cáo phân tích chuyên sâu cho các nhà đầu tư nhằm giúp doanh nghiệp tập trung hoạt động kinh doanh nhưng vẫn duy trì được tốt quan hệ với nhà đầu tư và các bên có liên quan.
- Thông thường các bên buyside đưa ra các tiêu chí rất cụ thể về chi tiết về minh bạch thông tin khi tìm hiểu và ra quyết định đầu tư/mua doanh nghiệp, các tiêu chí có thể bao gồm:
- Việc tích hợp yếu tố môi trường, xã hội, quản trị (ESG) vào quá trình ra quyết định đầu tư của các Quỹ đầu tư quốc tế đượcEVSđánh giá là xu hướng quan trọng và tất yếu trong hoạt động đầu tư. Để cập nhật xu hướng tích hợp ESG, Công ty đã thực hiện phát triển chuyên môn liên quan đến các khung tiêu chuẩn, đưa ra khung phân tích, và công cụ đo lường hiệu quả, truyền đạt các tác động to lớn của ESG đến các khách hàng, doanh nghiệp và các bên liên quan.
Doanh nghiệp muốn tiếp cận ESG điều đầu tiên cần đánh giá và xác định các yếu tố ESG quan trọng cho ngành và lĩnh vực kinh doanh của doanh nghiệp mình, sau khi xây dựng được một chiến lược (cam kết cụ thể), doanh nghiệp cần tích hợp vào hoạt động sản xuất kinh doanh và hành động theo cam kết đó.
Ví dụ 1 doanh nghiệp khi xác định tuyên bố về mặt quản trị theo DEI (Diversity, Equity, and Inclution) thì Doanh nghiệp phải áp dụng các nguyên tắc trên trong việc xây dựng một HĐQT và các cấp quản lý độc lập hơn để nâng cao chất lượng ra quyết định dựa trên các thông tin đa dạng nhằm hỗ trợ các nỗ lực thu hút khách hàng và mở rộng thị trường mới.
Nếu Doanh nghiệp áp dụng DEI như một tuyên bố về mặt xã hội thì doanh nghiệp phải áp dụng các nguyên tắc trên để xây dựng một chính sách tuyển dụng công bằng, tham gia gắn kết cộng đồng và có chiến lược mua sắm minh bạch phù hợp.
Trân trọng cảm ơn bà!","Thế Mạnh",""
"EVS","Công ty Cổ phần chứng khoán Everest Báo cáo tình hình thanh toán gốc lãi Bán niên (Kỳ báo cáo từ 01/01/2024 đến 30/06/2024) năm 2024","https://vietstock.vn/2024/09/cong-ty-co-phan-chung-khoan-everest-bao-cao-tinh-hinh-thanh-toan-goc-lai-ban-nien-ky-bao-cao-tu-01-01-2024-den-30-06-2024-nam-2024-3118-1227254.htm","09/09/2024","Công ty Cổ phần chứng khoán Everest Báo cáo tình hình thanh toán gốc lãi Bán niên (Kỳ báo cáo từ 01/01/2024 đến 30/06/2024) năm 2024","",""
"EVS","Công ty Cổ phần chứng khoán Everest Báo cáo tài chính Bán niên (Kỳ báo cáo từ 01/01/2024 đến 30/06/2024) năm 2024","https://vietstock.vn/2024/08/cong-ty-co-phan-chung-khoan-everest-bao-cao-tai-chinh-ban-nien-ky-bao-cao-tu-01-01-2024-den-30-06-2024-nam-2024-3118-1223669.htm","28/08/2024","Công ty Cổ phần chứng khoán Everest Báo cáo tài chính Bán niên (Kỳ báo cáo từ 01/01/2024 đến 30/06/2024) năm 2024","",""
"EVS","EVS: Báo cáo tài chính bán niên năm 2024","https://vietstock.vn/2024/08/evs-bao-cao-tai-chinh-ban-nien-nam-2024-737-1219641.htm","15/08/2024","EVS: Báo cáo tài chính bán niên năm 2024","",""
